{"action_limits":{"max_accel_mps2":null,"max_velocity_mps":0.1},"admissible_directives":{"modes":["safe_hold"],"tasks":["charge","standby"]},"compiled_version":"0.1","keep_out_terms":[{"center":[0.0,0.0,0.0],"collision_pair":null,"constraint_id":"c_lander_zone","frame":"MOON_ME","frame_ref":null,"half_extents":[],"margin_m":3.0,"normal":[],"offset":null,"on_uncertain":"fallback","radius":30.0,"shape":"sphere"},{"center":[500.0,-1200.0,0.0],"collision_pair":null,"constraint_id":"c_psr_crater","frame":"MOON_ME","frame_ref":null,"half_extents":[100.0,100.0,20.0],"margin_m":5.0,"normal":[],"offset":null,"on_uncertain":"fallback","radius":null,"shape":"box"},{"center":[],"collision_pair":null,"constraint_id":"c_slope_edge","frame":"MOON_ME","frame_ref":null,"half_extents":[],"margin_m":1.0,"normal":[0.0,0.0,1.0],"offset":2.0,"on_uncertain":"fallback","radius":null,"shape":"half_space"}],"monitors":[{"constraint_id":"c_night_soc_survival","history_window_len":1209600,"node_count":3,"on_uncertain":"safe_state","predicate_indices":[1,2],"root":{"args":[{"args":[],"interval_hi_samples":null,"interval_lo_samples":null,"op":"predicate","predicate_index":1},{"args":[],"interval_hi_samples":null,"interval_lo_samples":null,"op":"predicate","predicate_index":2}],"interval_hi_samples":1209600,"interval_lo_samples":0,"op":"until","predicate_index":null}},{"constraint_id":"c_night_thermal_survival","history_window_len":1209600,"node_count":2,"on_uncertain":"fallback","predicate_indices":[3],"root":{"args":[{"args":[],"interval_hi_samples":null,"interval_lo_samples":null,"op":"predicate","predicate_index":3}],"interval_hi_samples":1209600,"interval_lo_samples":0,"op":"always","predicate_index":null}}],"predicate_table":{"atoms":[{"op":"le","signal_index":0,"threshold":40.0},{"op":"ge","signal_index":1,"threshold":180000.0},{"op":"ge","signal_index":2,"threshold":1.0},{"op":"ge","signal_index":3,"threshold":120.0},{"op":"le","signal_index":3,"threshold":320.0},{"op":"ge","signal_index":4,"threshold":15.0},{"op":"le","signal_index":5,"threshold":0.1}],"signals":["anchor_torque_nm","battery_soc_j","charging_window_active","chassis_temp_k","power_available_w","traverse_speed_mps"]},"resource_bounds":{"keep_out_term_count":3,"max_history_len":1209600,"monitor_count":2,"predicate_slot_count":7,"scalar_bound_count":6,"worst_case_term_count":15},"safe_pose":{"frame":"MOON_ME","frame_ref":null,"position":[60.0,0.0,5.0]},"sample_period_s":1.0,"scalar_bounds":[{"atom_index":0,"constraint_id":"c_anchor_torque","on_uncertain":"fallback"},{"atom_index":1,"constraint_id":"c_energy_floor","on_uncertain":"safe_state"},{"atom_index":5,"constraint_id":"c_power_floor","on_uncertain":"fallback"},{"atom_index":4,"constraint_id":"c_thermal_ceiling","on_uncertain":"fallback"},{"atom_index":3,"constraint_id":"c_thermal_floor","on_uncertain":"fallback"},{"atom_index":6,"constraint_id":"c_traverse_speed","on_uncertain":"hold"}],"spec_content_hash":"sha256:e2a1737c6d05cb1b89f75d1dbcd5cb31be46fb9027a75bb1b0b0b642c8f1d0ee","spec_id":"anchor-lunar-polar-v0"}